video_id,channel_title,channel_id,video_publish_date,video_title,video_description,video_category,video_thumbnail,collection_date,video_view_count,video_comment_count,video_like_count,video_dislike_count
https://www.youtube.com/watch?v=hOXFTqmEOgY,Chigz Tech Reviews,UC-v54XQalOcx5yco3aTixrg,1721825916.0,Samsung Galaxy Watch 7  (44mm) - Brutally Honest Review - Watch before you buy!,Looking for an honest review of the Samsung Galaxy Watch 7? Watch this video before you buy! We'll give you all the details you ...,,https://i.ytimg.com/vi/hOXFTqmEOgY/hqdefault.jpg,2024-11-13 11:09:53.941368,220499,411,3134,
https://www.youtube.com/watch?v=kmGLLXUoc20,Chigz Tech Reviews,UC-v54XQalOcx5yco3aTixrg,1726340823.0,RingConn Gen 2 Smart Ring Review - Better than Samsung &amp; Oura?,"Discover the Ringconn Gen 2, the best smart ring in the world for 2024! Get yours now for only $209 in the last 24 hours before the ...",,https://i.ytimg.com/vi/kmGLLXUoc20/hqdefault.jpg,2024-11-13 11:09:53.941417,8911,35,168,
https://www.youtube.com/watch?v=BkJ5yrOe2EU,Chigz Tech Reviews,UC-v54XQalOcx5yco3aTixrg,1721594493.0,Nothing CMF Watch Pro 2 Review - Everything you need to Know - Any Good?,"Detailed review of the Nothing CMF Watch Pro 2, covering everything you need to know about this smart fitness watch. From its ...",,https://i.ytimg.com/vi/BkJ5yrOe2EU/hqdefault.jpg,2024-11-13 11:09:53.941638,129764,170,1447,
https://www.youtube.com/watch?v=LkUjGb78cnI,Chigz Tech Reviews,UC-v54XQalOcx5yco3aTixrg,1723718240.0,Powerful Beelink SEi14 Mini PC Review - Intel Ultra 5 - Any Good?,Looking for the best mini PC? Check out this powerful Beelink SEi14 Mini PC review to see if it's worth the hype! Find out if the ...,,https://i.ytimg.com/vi/LkUjGb78cnI/hqdefault.jpg,2024-11-13 11:09:53.941673,5988,21,203,
https://www.youtube.com/watch?v=EiSUQ_ccDjI,Chigz Tech Reviews,UC-v54XQalOcx5yco3aTixrg,1722186186.0,Samsung Galaxy Ring - Brutally Honest Review - What you did not know!,Get the brutally honest review of the Samsung Galaxy Ring! Find out what you didn't know about this Smart Ring in this in-depth ...,,https://i.ytimg.com/vi/EiSUQ_ccDjI/hqdefault.jpg,2024-11-13 11:09:53.941894,28384,127,619,
https://www.youtube.com/watch?v=F0QqeqWhgUI,Chigz Tech Reviews,UC-v54XQalOcx5yco3aTixrg,1709772387.0,OnePlus Watch 2 (47mm) - Brutally Honest Review - Watch before you buy!,OnePlus Watch 2 Brutally Honest Review | Best Wear OS Smartwatch? ➡️ Official: https://bit.ly/3InvKux ➡️ Smartwatch Chart ...,,https://i.ytimg.com/vi/F0QqeqWhgUI/hqdefault.jpg,2024-11-13 11:09:53.941986,78430,227,1353,
https://www.youtube.com/watch?v=JyyiIeXYNMA,Chigz Tech Reviews,UC-v54XQalOcx5yco3aTixrg,1705165506.0,MECOOL KM2 Plus Deluxe Review - S905X4 - Android TV - DOLBY VISION &amp; ATMOS- Any good?,Is the MECOOL KM2 Plus Deluxe really worth the hype? Find out in this video where we take a closer look at the features and ...,,https://i.ytimg.com/vi/JyyiIeXYNMA/hqdefault.jpg,2024-11-13 11:09:53.942063,31574,79,607,
https://www.youtube.com/watch?v=f0SJ9VbN8TY,Chigz Tech Reviews,UC-v54XQalOcx5yco3aTixrg,1718893109.0,Anbernic RG556 Review - MOST Powerful Android Handheld by Anbernic - Any Good?,"Experience gaming like never before with the Anbernic RG556 handheld console, delivering unparalleled performance and a ...",,https://i.ytimg.com/vi/f0SJ9VbN8TY/hqdefault.jpg,2024-11-13 11:09:53.942100,21098,60,327,
https://www.youtube.com/watch?v=oO5lFHZ6B9A,Chigz Tech Reviews,UC-v54XQalOcx5yco3aTixrg,1728420276.0,Samsung Galaxy FE - Brutally Honest Review - Only £169 (Prime Sale),Looking for a brutally honest review of the Samsung Galaxy FE? Check out this video to get the scoop on this affordable device!,,https://i.ytimg.com/vi/oO5lFHZ6B9A/hqdefault.jpg,2024-11-13 11:09:53.942145,13516,34,250,
https://www.youtube.com/watch?v=lET5ftV-jtY,Chigz Tech Reviews,UC-v54XQalOcx5yco3aTixrg,1691257056.0,Samsung Galaxy Watch 6 Classic (47mm) - Brutally Honest Review - Watch before you buy!,Samsung Galaxy Watch 6 Classic (47mm) - Brutally Honest Review - Watch before you buy! My full in-depth review of the ...,,https://i.ytimg.com/vi/lET5ftV-jtY/hqdefault.jpg,2024-11-13 11:09:53.942343,527257,698,6752,
https://www.youtube.com/watch?v=UtNqGZ2WitQ,Chigz Tech Reviews,UC-v54XQalOcx5yco3aTixrg,1708898265.0,Xiaomi 14 Honest Review: Pros &amp; Cons - Must Watch!,"Check out our in-depth review of the Xiaomi 14 Smartphone, featuring a powerful SD 8 GEN3 processor! We'll cover the pros and ...",,https://i.ytimg.com/vi/UtNqGZ2WitQ/hqdefault.jpg,2024-11-13 11:09:53.942395,97322,236,1531,
https://www.youtube.com/watch?v=1jsuXfytQD8,Chigz Tech Reviews,UC-v54XQalOcx5yco3aTixrg,1569496235.0,Amazon BLINK XT2 Wireless Home Security Camera Setup + Review ONLY £99,BLINK XT2 Wireless Home Security Camera Setup + Review ONLY £99 ✓ Amazon UK: https://amzn.to/2uGk57z ✓ Amazon US: ...,,https://i.ytimg.com/vi/1jsuXfytQD8/hqdefault.jpg,2024-11-13 11:09:53.942550,84574,95,1079,
https://www.youtube.com/watch?v=nNySOIZ2y54,Chigz Tech Reviews,UC-v54XQalOcx5yco3aTixrg,1710618139.0,Xiaomi Watch S3 Review | Extremely Good Smartwatch Under £130!,"In this video, we'll give you a detailed review of the Xiaomi Watch S3, one of the best smartwatches on the market under £130.",,https://i.ytimg.com/vi/nNySOIZ2y54/hqdefault.jpg,2024-11-13 11:09:53.942625,129158,149,3267,
https://www.youtube.com/watch?v=1gzJRfj7B7A,Chigz Tech Reviews,UC-v54XQalOcx5yco3aTixrg,1709405240.0,Xiaomi Watch 2 (47mm) Honest Review: Best WearOS Smartwatch Under £150?,"Check out my review of the Xiaomi Watch 2, equipped with WearOS and Snapdragon W5+ Gen1, all for a budget-friendly price of ...",,https://i.ytimg.com/vi/1gzJRfj7B7A/hqdefault.jpg,2024-11-13 11:09:53.942676,63866,141,787,
https://www.youtube.com/watch?v=0eJ4717jYZk,Chigz Tech Reviews,UC-v54XQalOcx5yco3aTixrg,1719573556.0,Powerful GEEKOM A8 Mini Gaming PC Review - RYZEN 9 (8945HS) - Any Good?,Experience the ultimate gaming and streaming capabilities of the Geekom A8 Mini PC in action! From playing high bitrate 4K ...,,https://i.ytimg.com/vi/0eJ4717jYZk/hqdefault.jpg,2024-11-13 11:09:53.942700,11986,46,239,
